Number,Title,Body,Closed,Merged,MergedAt,ClosedAt,ReviewComments,Participants,Comments,Files,Additions,Deletions,Modifications,TimeToMergeOrClose
5952,added comments for each function for easier understanding,673,True,False,,2023-10-25T19:47:46Z,0,1,1,1,22,31,53,0
5948,sycn,640,True,False,,2023-10-25T17:52:43Z,0,2,3,12,132,52,184,0
5942,MangoAgent-1 entering the arena,1568,True,False,,2023-10-25T16:09:19Z,0,2,1,1,6,0,6,0
5943,MangoAgent-2 entering the arena,1568,True,False,,2023-10-25T16:09:10Z,0,2,1,1,6,0,6,0
5944,MangoAgent-3 entering the arena,1568,True,True,2023-10-25T16:09:00Z,2023-10-25T16:09:00Z,0,2,1,1,6,0,6,1653.0
5930,FcsummerGPT entering the arena,1567,True,False,,2023-10-25T09:45:19Z,0,1,1,1,6,0,6,0
5472,Zerogpt 03 dev,640,True,False,,2023-10-02T17:18:01Z,0,1,2,198,27471,0,27471,0
5927,first entering the arena,1560,True,False,,2023-10-25T01:28:32Z,0,1,1,1,6,0,6,0
5926,notsurewhatthisis entering the arena,1569,True,False,,2023-10-24T17:21:24Z,0,1,1,1,6,0,6,0
5907,smartcode entering the arena,1565,True,False,,2023-10-24T01:32:44Z,0,1,1,1,6,0,6,0
5891,Petor entering the arena,1566,True,False,,2023-10-23T13:20:47Z,0,1,1,1,6,0,6,0
5880,ccace entering the arena,1560,True,True,2023-10-23T09:20:52Z,2023-10-23T09:20:52Z,0,2,1,1,6,0,6,3128.0
5877,miniAgent entering the arena,1560,True,True,2023-10-23T09:20:35Z,2023-10-23T09:20:35Z,0,2,1,1,6,0,6,23928.0
5876,metware entering the arena,1561,True,True,2023-10-23T09:20:19Z,2023-10-23T09:20:19Z,0,2,1,1,6,0,6,24984.0
5874,zaheer entering the arena,1565,True,True,2023-10-23T09:20:00Z,2023-10-23T09:20:00Z,0,2,1,1,6,0,6,41465.0
5872,first-agent entering the arena,640,True,True,2023-10-23T09:19:46Z,2023-10-23T09:19:46Z,0,2,1,1,6,0,6,65467.0
5870,autogpt-hackathon2 entering the arena,1586,True,True,2023-10-23T09:19:29Z,2023-10-23T09:19:29Z,0,2,1,1,6,0,6,89024.0
5869,career-agent entering the arena,1569,True,True,2023-10-23T09:19:14Z,2023-10-23T09:19:14Z,0,2,1,1,6,0,6,90847.0
5867,autogpt_hackathon1 entering the arena,1586,True,True,2023-10-23T09:18:53Z,2023-10-23T09:18:53Z,0,2,1,1,6,0,6,94072.0
5866,480bot entering the arena,1555,True,True,2023-10-23T09:18:37Z,2023-10-23T09:18:37Z,0,2,1,1,6,0,6,95322.0
5865,gaby_agent entering the arena,640,True,True,2023-10-23T09:17:59Z,2023-10-23T09:17:59Z,0,2,1,1,6,0,6,120154.0
5864,AutoGPT-ariel entering the arena,1569,True,True,2023-10-23T09:17:40Z,2023-10-23T09:17:40Z,0,2,1,1,6,0,6,125167.0
5862,testagent entering the arena,1568,True,False,,2023-10-23T09:17:24Z,0,2,1,1,6,0,6,0
5881,exploring,640,True,False,,2023-10-23T08:51:18Z,0,1,2,57,9931,0,9931,0
5879,miki entering the arena,640,True,False,,2023-10-23T05:27:11Z,0,1,1,1,6,0,6,0
5878,bobbobson entering the arena,1569,True,False,,2023-10-23T04:34:53Z,0,1,1,1,6,0,6,0
5654,Forge/workshop,640,True,True,2023-10-09T15:32:53Z,2023-10-09T15:32:53Z,0,3,4,17,1358,381,1739,148.0
5785,Rename autogpts/autogpt/CITATION.cff to CITATION.cff,640,True,True,2023-10-22T18:25:05Z,2023-10-22T18:25:05Z,8,3,1,1,1,1,2,442318.0
5873,Create devcontainer.json,640,True,False,,2023-10-22T17:57:31Z,4,3,1,1,5,0,5,0
5619,chappigpt entering the arena,660,True,True,2023-10-19T09:32:29Z,2023-10-19T09:32:29Z,1,2,1,1,6,0,6,961428.0
5609,AutoHoneyComber entering the arena,1086,True,False,,2023-10-19T09:33:17Z,0,2,3,60,8688,0,8688,0
5863,nick entering the arena,1558,True,False,,2023-10-21T19:15:00Z,0,1,1,1,6,0,6,0
5861,business entering the arena,1567,True,True,2023-10-21T16:19:47Z,2023-10-21T16:19:47Z,0,2,1,1,6,0,6,459.0
5860,CCAgent entering the arena,1562,True,True,2023-10-21T16:19:30Z,2023-10-21T16:19:30Z,0,2,1,1,6,0,6,8533.0
5857,AlphaCISO entering the arena,1564,True,True,2023-10-21T16:19:16Z,2023-10-21T16:19:16Z,0,2,1,1,6,0,6,28352.0
5856,easn entering the arena,1560,True,True,2023-10-21T16:19:01Z,2023-10-21T16:19:01Z,0,2,1,1,6,0,6,29874.0
5854,stefan entering the arena,1560,True,True,2023-10-21T16:18:31Z,2023-10-21T16:18:31Z,0,2,1,1,6,0,6,54921.0
5859,superjaff entering the arena,1564,True,False,,2023-10-21T11:31:44Z,0,1,1,1,6,0,6,0
5858,smithy entering the arena,1559,True,False,,2023-10-21T08:37:26Z,0,1,1,1,6,0,6,0
5855,PHRASE_GEN entering the arena,1567,True,False,,2023-10-21T06:27:12Z,0,1,1,1,6,0,6,0
5851,akela entering the arena,1561,True,True,2023-10-20T20:09:01Z,2023-10-20T20:09:01Z,0,2,1,1,6,0,6,4349.0
5852,AutoGPT entering the arena,640,True,False,,2023-10-20T18:58:41Z,0,1,1,1,6,0,6,0
5850,akela2 entering the arena,1562,True,False,,2023-10-20T18:53:20Z,0,1,1,1,6,0,6,0
5849,akela entering the arena,1561,True,False,,2023-10-20T18:53:20Z,0,1,1,1,6,0,6,0
5848,kingmitch entering the arena,640,True,True,2023-10-20T17:21:23Z,2023-10-20T17:21:23Z,0,2,1,1,6,0,6,127.0
5847,analystgpt entering the arena,1565,True,True,2023-10-20T17:12:23Z,2023-10-20T17:12:24Z,0,2,1,1,6,0,6,1569.0
5846,analyst entering the arena,1562,True,False,,2023-10-20T17:12:09Z,0,2,1,1,6,0,6,0
5825,woohoo_agent entering the arena,1569,True,True,2023-10-20T14:04:49Z,2023-10-20T14:04:49Z,0,2,1,1,6,0,6,82182.0
5826,LAWYER_EMAD entering the arena,640,True,True,2023-10-20T14:04:35Z,2023-10-20T14:04:35Z,0,2,1,1,6,0,6,81001.0
5828,UniAgent entering the arena,1567,True,True,2023-10-20T14:04:21Z,2023-10-20T14:04:21Z,0,2,1,1,6,0,6,75567.0
5830,contentstrategy entering the arena,1572,True,True,2023-10-20T14:04:03Z,2023-10-20T14:04:03Z,0,2,1,1,6,0,6,64238.0
5831,MyExample entering the arena,1564,True,True,2023-10-20T14:03:45Z,2023-10-20T14:03:45Z,0,2,1,1,6,0,6,57774.0
5832,AwareAgent entering the arena,654,True,True,2023-10-20T14:03:30Z,2023-10-20T14:03:30Z,0,2,1,1,6,0,6,52247.0
5833,YoudaoAutoGPT entering the arena,1569,True,True,2023-10-20T14:03:17Z,2023-10-20T14:03:17Z,0,2,1,1,6,0,6,39649.0
5834,ZJgpt entering the arena,1561,True,True,2023-10-20T14:02:48Z,2023-10-20T14:02:48Z,0,2,1,1,6,0,6,35888.0
5835,UGYUJI entering the arena,1558,True,True,2023-10-20T14:02:34Z,2023-10-20T14:02:34Z,0,2,1,1,6,0,6,33603.0
5837,ResearchAgent entering the arena,1359,True,True,2023-10-20T14:02:21Z,2023-10-20T14:02:21Z,0,2,1,1,6,0,6,28442.0
5839,WYC entering the arena,1561,True,True,2023-10-20T14:02:06Z,2023-10-20T14:02:06Z,0,2,1,1,6,0,6,22777.0
5841,devagent entering the arena,1556,True,True,2023-10-20T14:01:50Z,2023-10-20T14:01:51Z,0,2,1,1,6,0,6,19940.0
5827,agsCehAgent entering the arena,640,True,True,2023-10-20T14:01:29Z,2023-10-20T14:01:29Z,0,2,1,1,6,0,6,79177.0
5842,Bagi_agent entering the arena,640,True,True,2023-10-20T14:00:21Z,2023-10-20T14:00:21Z,0,2,1,1,6,0,6,16412.0
5843,hello entering the arena,1558,True,True,2023-10-20T14:00:00Z,2023-10-20T14:00:00Z,0,2,1,1,6,0,6,15758.0
5844,Pumu2_agent entering the arena,640,True,True,2023-10-20T13:59:46Z,2023-10-20T13:59:46Z,0,2,2,1,6,0,6,13810.0
5845,testAgent entering the arena,1562,True,True,2023-10-20T13:59:10Z,2023-10-20T13:59:10Z,0,2,1,1,6,0,6,9112.0
5840,cedric-test entering the arena,1568,True,False,,2023-10-20T07:58:08Z,0,1,1,1,6,0,6,0
5836,LWYC entering the arena,1559,True,False,,2023-10-20T06:47:34Z,0,1,1,1,6,0,6,0
5821,zhizhi entering the arena,1558,True,True,2023-10-20T00:48:02Z,2023-10-20T00:48:02Z,0,2,1,1,6,0,6,47301.0
5824,NadeemAgent entering the arena,1566,True,True,2023-10-20T00:46:59Z,2023-10-20T00:46:59Z,0,2,1,1,6,0,6,38115.0
5731,rename arena agent (hackathonishe -> dive2code),685,True,True,2023-10-19T09:25:05Z,2023-10-19T09:25:05Z,0,2,1,2,6,6,12,458729.0
1457,Add memory backend using sqlite and zarr,1492,True,False,,2023-10-19T20:41:43Z,4,8,14,7,474,0,474,0
5829,Ras-le-Bot entering the arena,640,True,False,,2023-10-19T20:39:47Z,0,1,1,1,6,0,6,0
5728,Second tutorial incomplete paragraph?,860,True,False,,2023-10-19T18:05:24Z,0,2,5,0,0,0,0,0
5813,Fix typo in exceptions.py,660,True,True,2023-10-19T17:22:21Z,2023-10-19T17:22:21Z,0,2,1,1,1,1,2,42015.0
5822,Breathe,755,True,False,,2023-10-19T13:15:31Z,0,2,2,11,406,35,441,0
5819,Arena submission ai ceh agent,640,True,False,,2023-10-19T10:53:28Z,0,2,4,61,10120,0,10120,0
5820,momo entering the arena,1557,True,False,,2023-10-19T11:05:07Z,0,1,1,1,2,2,4,0
5818,Arena submission ai ceh agent,640,True,False,,2023-10-19T10:39:15Z,0,1,2,61,10120,0,10120,0
5410,Improved Documentation for Windows Users,1550,True,True,2023-10-19T10:20:32Z,2023-10-19T10:20:32Z,0,2,1,1,33,0,33,1689179.0
5817,momo entering the arena,1557,True,False,,2023-10-19T10:04:37Z,0,2,1,1,6,0,6,0
5805,updated CLI-USAGE.md agents command to current agent command,879,True,True,2023-10-19T10:08:05Z,2023-10-19T10:08:05Z,0,2,1,1,5,5,10,68235.0
5722,removing duplicates,39,True,False,,2023-10-19T10:05:54Z,0,2,1,5,3,25,28,0
5700,docs: fix typo in QUICKSTART.md,742,True,True,2023-10-19T10:05:41Z,2023-10-19T10:05:41Z,0,2,1,1,1,1,2,610969.0
5715,fix typo,691,True,True,2023-10-19T10:05:20Z,2023-10-19T10:05:20Z,0,2,1,1,1,1,2,540317.0
5720,typo Heisenberg.json,649,True,True,2023-10-19T10:04:57Z,2023-10-19T10:04:57Z,0,2,1,1,3,1,4,504945.0
5816,stockAgent entering the arena,1568,True,True,2023-10-19T10:04:19Z,2023-10-19T10:04:19Z,0,2,1,1,6,0,6,867.0
5714,ASSISTANT entering the arena,1562,True,True,2023-10-19T10:04:02Z,2023-10-19T10:04:02Z,0,2,1,1,6,0,6,542458.0
5713,icode entering the arena,1560,True,True,2023-10-19T10:03:44Z,2023-10-19T10:03:44Z,0,2,1,1,6,0,6,550450.0
5711,Lirum entering the arena,1560,True,True,2023-10-19T10:02:43Z,2023-10-19T10:02:43Z,0,2,1,1,6,0,6,557869.0
5704,Lab49Agent entering the arena,1577,True,True,2023-10-19T10:02:24Z,2023-10-19T10:02:24Z,0,2,1,1,6,0,6,603226.0
5698,aiaudit entering the arena,640,True,True,2023-10-19T10:01:01Z,2023-10-19T10:01:01Z,0,2,1,1,6,0,6,615211.0
5697,bot01 entering the arena,1562,True,True,2023-10-19T10:00:44Z,2023-10-19T10:00:44Z,0,2,1,1,6,0,6,625451.0
5696,AgentJPark entering the arena,1567,True,True,2023-10-19T10:00:23Z,2023-10-19T10:00:23Z,0,2,1,1,6,0,6,632418.0
5693,AutoTDD entering the arena,1560,True,True,2023-10-19T10:00:07Z,2023-10-19T10:00:07Z,0,2,1,1,6,0,6,657933.0
5689,AndersLensway entering the arena,1565,True,True,2023-10-19T09:59:50Z,2023-10-19T09:59:50Z,0,2,1,1,6,0,6,687571.0
5688,babe_perphorator_ entering the arena,640,True,True,2023-10-19T09:59:32Z,2023-10-19T09:59:32Z,0,2,1,1,6,0,6,691986.0
5683,xmly entering the arena,1562,True,True,2023-10-19T09:59:20Z,2023-10-19T09:59:20Z,0,2,1,1,6,0,6,703747.0
5680,aWOL entering the arena,1554,True,True,2023-10-19T09:59:08Z,2023-10-19T09:59:08Z,0,2,1,1,6,0,6,722103.0
5679,cislerk2 entering the arena,1561,True,True,2023-10-19T09:58:48Z,2023-10-19T09:58:48Z,0,2,1,1,6,0,6,737589.0
5675,yarbis entering the arena,1560,True,True,2023-10-19T09:58:32Z,2023-10-19T09:58:32Z,0,2,1,1,6,0,6,748039.0
5674,newAgent entering the arena,1567,True,True,2023-10-19T09:58:17Z,2023-10-19T09:58:17Z,0,2,1,1,6,0,6,779426.0
5672,fst entering the arena,1558,True,True,2023-10-19T09:58:06Z,2023-10-19T09:58:06Z,0,2,1,1,6,0,6,787997.0
5671,AUTO_GPT_JON001 entering the arena,1585,True,True,2023-10-19T09:57:53Z,2023-10-19T09:57:53Z,0,2,1,1,6,0,6,791786.0
5815,momo entering the arena,1557,True,True,2023-10-19T09:50:19Z,2023-10-19T09:50:19Z,0,2,1,1,6,0,6,614.0
5668,chatgpt_taller entering the arena,1568,True,True,2023-10-19T09:52:20Z,2023-10-19T09:52:20Z,0,2,1,1,6,0,6,798335.0
5665,researchGPT entering the arena,1564,True,True,2023-10-19T09:52:05Z,2023-10-19T09:52:05Z,0,2,1,1,6,0,6,814534.0
5664,CYNO_AGENT entering the arena,1561,True,True,2023-10-19T09:51:47Z,2023-10-19T09:51:47Z,0,2,1,1,6,0,6,827439.0
5655,autoai entering the arena,1562,True,True,2023-10-19T09:51:32Z,2023-10-19T09:51:32Z,0,2,1,1,6,0,6,840733.0
5717,dndagent entering the arena,1563,True,True,2023-10-19T09:51:02Z,2023-10-19T09:51:02Z,0,2,1,1,6,0,6,536568.0
5719,webgeek entering the arena,640,True,True,2023-10-19T09:50:41Z,2023-10-19T09:50:41Z,0,3,1,1,6,0,6,530698.0
5678,cislerk entering the arena,1560,True,False,,2023-10-19T09:49:21Z,0,2,1,1,6,0,6,0
5653,TLGPT entering the arena,1565,True,True,2023-10-19T09:43:44Z,2023-10-19T09:43:44Z,0,2,1,1,6,0,6,846551.0
5627,rachael entering the arena,640,True,True,2023-10-19T09:43:13Z,2023-10-19T09:43:13Z,0,2,1,1,6,0,6,937422.0
5629,jarvis2 entering the arena,1563,True,True,2023-10-19T09:42:59Z,2023-10-19T09:42:59Z,0,2,1,1,6,0,6,929951.0
5634,wedding-planner entering the arena,1571,True,True,2023-10-19T09:42:36Z,2023-10-19T09:42:37Z,0,2,1,1,6,0,6,911450.0
5639,operationAgent entering the arena,1567,True,True,2023-10-19T09:42:18Z,2023-10-19T09:42:18Z,0,2,1,1,6,0,6,890416.0
5641,autogpt_hackathon entering the arena,1585,True,True,2023-10-19T09:41:56Z,2023-10-19T09:41:56Z,0,2,1,1,6,0,6,887210.0
5642,ailabby entering the arena,1562,True,False,,2023-10-19T09:41:48Z,0,2,1,1,6,0,6,0
5643,wowozi entering the arena,1561,True,False,,2023-10-19T09:41:43Z,0,2,1,1,6,0,6,0
5645,aiwowo entering the arena,1561,True,True,2023-10-19T09:41:37Z,2023-10-19T09:41:37Z,0,2,1,1,6,0,6,879357.0
5648,HMD2 entering the arena,1557,True,True,2023-10-19T09:41:16Z,2023-10-19T09:41:16Z,0,2,1,1,6,0,6,870864.0
5649,JackGPT entering the arena,1562,True,True,2023-10-19T09:41:04Z,2023-10-19T09:41:04Z,0,2,1,1,6,0,6,868464.0
5651,autogbd entering the arena,1559,True,True,2023-10-19T09:40:48Z,2023-10-19T09:40:48Z,0,2,1,1,6,0,6,856508.0
5652,RFPScanner entering the arena,1567,True,True,2023-10-19T09:40:38Z,2023-10-19T09:40:38Z,0,2,1,1,6,0,6,853405.0
5633,theone entering the arena,1560,True,True,2023-10-19T09:39:59Z,2023-10-19T09:39:59Z,0,2,1,1,6,0,6,915848.0
5669,test1 entering the arena,640,True,False,,2023-10-19T09:39:17Z,0,2,1,1,6,0,6,0
5699,my_agent entering the arena,1564,True,False,,2023-10-19T09:39:11Z,0,2,1,1,6,0,6,0
5718,autogpt entering the arena,1562,True,False,,2023-10-19T09:39:06Z,0,2,1,1,6,0,6,0
5710,my_test entering the arena,1562,True,False,,2023-10-19T09:39:02Z,0,2,1,1,6,0,6,0
5666,testAgent entering the arena,1566,True,False,,2023-10-19T09:38:58Z,0,2,1,1,6,0,6,0
5662,AutoGPT1 entering the arena,1560,True,False,,2023-10-19T09:38:55Z,0,2,1,1,6,0,6,0
5650,OctopusAgent entering the arena,1564,True,False,,2023-10-19T09:38:51Z,0,2,2,62,8907,0,8907,0
5637,Agent1 entering the arena,1563,True,False,,2023-10-19T09:38:47Z,0,2,1,1,6,0,6,0
5636,AutoGPT entering the arena,1563,True,False,,2023-10-19T09:38:42Z,0,2,2,1,6,0,6,0
5635,TestAgent1479 entering the arena,1580,True,False,,2023-10-19T09:38:38Z,0,2,1,1,6,0,6,0
5626,test-agent entering the arena,1562,True,False,,2023-10-19T09:38:34Z,0,2,1,1,6,0,6,0
5624,test_agent entering the arena,1562,True,False,,2023-10-19T09:38:29Z,0,2,1,1,6,0,6,0
5603,foobar entering the arena,1560,True,True,2023-10-19T09:37:12Z,2023-10-19T09:37:12Z,0,2,1,1,6,0,6,1008790.0
5610,RAGOptimizer entering the arena,1564,True,True,2023-10-19T09:36:53Z,2023-10-19T09:36:53Z,0,2,1,1,6,0,6,989099.0
5613,Yui3 entering the arena,1563,True,True,2023-10-19T09:36:35Z,2023-10-19T09:36:35Z,0,2,1,1,6,0,6,977547.0
5615,MOBILE entering the arena,1558,True,True,2023-10-19T09:36:20Z,2023-10-19T09:36:20Z,0,2,1,1,6,0,6,973537.0
5620,chappyAi entering the arena,640,True,True,2023-10-19T09:34:50Z,2023-10-19T09:34:51Z,0,2,2,1,6,0,6,960191.0
5590,example_1 entering the arena,1565,True,False,,2023-10-19T09:34:15Z,0,2,1,1,6,0,6,0
5601,HACKATHON entering the arena,1567,True,True,2023-10-19T09:34:11Z,2023-10-19T09:34:11Z,0,2,1,1,6,0,6,1010310.0
5605,TRAVEL_AGENT entering the arena,1569,True,False,,2023-10-19T09:33:58Z,0,3,3,62,8907,0,8907,0
5607,info-retrieval entering the arena,1570,True,True,2023-10-19T09:33:25Z,2023-10-19T09:33:25Z,0,2,1,1,6,0,6,993311.0
5611,CreaitorMarketing entering the arena,1573,True,True,2023-10-19T09:33:04Z,2023-10-19T09:33:04Z,0,2,1,1,6,0,6,988070.0
5614,Zeus entering the arena,1562,True,True,2023-10-19T09:32:45Z,2023-10-19T09:32:45Z,0,2,1,1,6,0,6,975652.0
5621,a_reverent_heart entering the arena,1580,True,True,2023-10-19T09:32:11Z,2023-10-19T09:32:11Z,0,2,1,1,6,0,6,955713.0
5623,AutoGPT_Agent entering the arena,1566,True,False,,2023-10-19T09:31:59Z,0,3,1,1,6,0,6,0
5602,SmartAgent entering the arena,1576,True,False,,2023-10-19T09:29:25Z,0,2,1,1,6,0,6,0
5600,MANU entering the arena,1562,True,True,2023-10-19T09:29:14Z,2023-10-19T09:29:14Z,0,2,1,1,6,0,6,1010339.0
5598,yui2 entering the arena,1563,True,False,,2023-10-19T09:29:06Z,0,2,1,2,12,0,12,0
5591,example_2 entering the arena,1565,True,False,,2023-10-19T09:27:56Z,0,2,1,1,6,0,6,0
5415,gpt-engineer entering the arena,1576,True,True,2023-10-19T09:27:43Z,2023-10-19T09:27:43Z,0,3,3,1,6,0,6,1651138.0
5725,GameSoundGPT entering the arena,1567,True,True,2023-10-19T09:25:26Z,2023-10-19T09:25:27Z,0,2,1,1,6,0,6,499040.0
5730,han entering the arena,1559,True,True,2023-10-19T09:24:29Z,2023-10-19T09:24:29Z,0,2,1,1,6,0,6,462150.0
5732,TRAVIS entering the arena,1559,True,True,2023-10-19T09:24:15Z,2023-10-19T09:24:15Z,0,2,1,1,6,0,6,456644.0
5733,AgentKD entering the arena,1561,True,True,2023-10-19T09:24:02Z,2023-10-19T09:24:02Z,0,2,1,1,6,0,6,456531.0
5734,test_agent entering the arena,1579,True,False,,2023-10-19T09:23:47Z,0,2,1,1,6,0,6,0
5735,date-buffer entering the arena,1567,True,True,2023-10-19T09:23:34Z,2023-10-19T09:23:34Z,0,2,1,1,6,0,6,451684.0
5737,XXY entering the arena,1560,True,True,2023-10-19T09:23:19Z,2023-10-19T09:23:20Z,0,2,1,1,6,0,6,448953.0
5741,example-agent entering the arena,1576,True,False,,2023-10-19T09:23:07Z,0,2,1,1,6,0,6,0
5742,test_agent entering the arena,1567,True,False,,2023-10-19T09:22:55Z,0,2,1,1,6,0,6,0
5770,assistant1 entering the arena,1570,True,True,2023-10-19T09:22:46Z,2023-10-19T09:22:47Z,0,2,1,1,6,0,6,226049.0
5771,letstest entering the arena,1570,True,True,2023-10-19T09:22:34Z,2023-10-19T09:22:34Z,0,3,1,1,6,0,6,225843.0
5772,letst entering the arena,1567,True,True,2023-10-19T09:22:17Z,2023-10-19T09:22:17Z,0,3,1,1,6,0,6,224072.0
5774,test2 entering the arena,1567,True,False,,2023-10-19T09:21:56Z,0,3,1,1,6,0,6,0
5775,autotest3 entering the arena,1571,True,False,,2023-10-19T09:21:46Z,0,3,1,1,6,0,6,0
5776,RosterAgent entering the arena,1569,True,True,2023-10-19T09:21:32Z,2023-10-19T09:21:32Z,0,3,1,1,6,0,6,201866.0
5777,lcdegpt entering the arena,1558,True,True,2023-10-19T09:21:15Z,2023-10-19T09:21:15Z,0,2,1,1,6,0,6,181247.0
5779,eddy entering the arena,1559,True,True,2023-10-19T09:20:47Z,2023-10-19T09:20:47Z,0,2,1,1,6,0,6,175058.0
5780,ZhaoJianAutoGPT entering the arena,1572,True,True,2023-10-19T09:20:31Z,2023-10-19T09:20:31Z,0,2,1,1,6,0,6,171557.0
5781,Adtractive_Agent entering the arena,1577,True,True,2023-10-19T09:20:10Z,2023-10-19T09:20:10Z,0,3,1,1,6,0,6,158631.0
5783,GeorgeGPT entering the arena,1563,True,True,2023-10-19T09:19:56Z,2023-10-19T09:19:56Z,0,2,1,1,6,0,6,153671.0
5784,researchGPT2 entering the arena,1565,True,True,2023-10-19T09:19:41Z,2023-10-19T09:19:41Z,0,2,1,1,6,0,6,151022.0
5789,JarvisAgent entering the arena,1565,True,True,2023-10-19T09:19:23Z,2023-10-19T09:19:23Z,0,2,1,1,6,0,6,138601.0
5793,jonesyboi entering the arena,1565,True,True,2023-10-19T09:19:07Z,2023-10-19T09:19:07Z,0,2,1,1,6,0,6,110401.0
5790,My_Test_Agent entering the arena,1571,True,False,,2023-10-19T09:18:51Z,0,2,1,1,6,0,6,0
5795,YOUR_AGENT_NAME_3 entering the arena,1568,True,False,,2023-10-19T09:18:40Z,0,2,1,1,6,0,6,0
5796,YOUR_AGENT_NAME_6 entering the arena,1568,True,False,,2023-10-19T09:18:30Z,0,2,1,1,6,0,6,0
5797,martingpt entering the arena,1565,True,True,2023-10-19T09:18:20Z,2023-10-19T09:18:20Z,0,2,1,1,6,0,6,100078.0
5798,engineer entering the arena,1560,True,True,2023-10-19T09:18:00Z,2023-10-19T09:18:00Z,0,2,1,1,6,0,6,93370.0
5799,my_fx_agent entering the arena,640,True,True,2023-10-19T09:17:44Z,2023-10-19T09:17:44Z,2,3,1,1,6,0,6,91747.0
5801,FynAgent entering the arena,1512,True,True,2023-10-19T09:17:26Z,2023-10-19T09:17:26Z,0,2,1,1,6,0,6,83560.0
5575,teste1 entering the arena,1559,True,False,,2023-10-19T09:17:06Z,0,2,1,1,6,0,6,0
5589,shivi entering the arena,1562,True,True,2023-10-19T09:16:39Z,2023-10-19T09:16:39Z,0,2,1,1,6,0,6,1064241.0
5814,baby_agent entering the arena,1561,True,True,2023-10-19T09:16:03Z,2023-10-19T09:16:03Z,0,2,1,1,6,0,6,5805.0
5812,WowGPTAgent entering the arena,640,True,False,,2023-10-19T05:01:01Z,0,1,1,1,6,0,6,0
5804,MyTestAgent entering the arena,640,True,True,2023-10-18T23:49:17Z,2023-10-18T23:49:17Z,0,2,1,1,6,0,6,34845.0
5806,Marx entering the arena,1561,True,True,2023-10-18T23:48:42Z,2023-10-18T23:48:42Z,0,2,1,1,6,0,6,24139.0
5808,AutoGPT2 entering the arena,1564,True,True,2023-10-18T23:48:19Z,2023-10-18T23:48:19Z,0,2,1,1,6,0,6,21853.0
5807,AutoGPT entering the arena,1563,True,False,,2023-10-18T23:48:07Z,0,2,1,1,6,0,6,0
5803,zxy entering the arena,640,True,False,,2023-10-18T12:54:19Z,0,1,1,1,6,0,6,0
5802,YOUR_AGENT_NAME entering the arena,640,True,False,,2023-10-18T12:53:06Z,0,1,1,1,6,0,6,0
5800,engineer entering the arena,1560,True,False,,2023-10-18T10:00:43Z,0,1,1,1,6,0,6,0
5794,YOUR_AGENT_NAME_2 entering the arena,1568,True,False,,2023-10-18T03:29:00Z,0,1,1,1,6,0,6,0
5792,YOUR_AGENT_NAME_1 entering the arena,1568,True,False,,2023-10-18T02:52:23Z,0,1,1,1,6,0,6,0
5644,YOUR_AGENT_NAME entering the arena,1566,True,False,,2023-10-18T02:52:22Z,0,1,1,1,6,0,6,0
5640,MY_AGENT_NAME entering the arena,1564,True,False,,2023-10-18T02:52:14Z,0,1,1,1,6,0,6,0
5791,IzkorGPT entering the arena,1561,True,False,,2023-10-18T00:26:01Z,0,1,1,1,6,0,6,0
5788,dogama entering the arena,1559,True,False,,2023-10-17T18:17:16Z,0,1,1,1,6,0,6,0
5759,Forge: add output fields to DB StepModel,915,True,True,2023-10-17T17:17:16Z,2023-10-17T17:17:16Z,0,1,1,2,18,6,24,144960.0
5739,LinuzGPT entering the arena,1565,True,True,2023-10-17T16:43:12Z,2023-10-17T16:43:12Z,0,2,1,1,6,0,6,293053.0
5743,MyFirstAgent entering the arena,1571,True,True,2023-10-16T18:04:29Z,2023-10-16T18:04:29Z,0,2,1,1,6,0,6,182232.0
5744,billy entering the arena,1557,True,True,2023-10-16T18:02:58Z,2023-10-16T18:02:58Z,0,2,1,1,6,0,6,173462.0
5746,xt0m-GPT entering the arena,1562,True,True,2023-10-16T18:02:29Z,2023-10-16T18:02:29Z,0,2,1,1,6,0,6,145880.0
5747,AutoTestGenerator entering the arena,1572,True,True,2023-10-16T18:01:39Z,2023-10-16T18:01:39Z,0,2,1,1,6,0,6,119876.0
5749,testGPT entering the arena,1558,True,True,2023-10-16T18:01:06Z,2023-10-16T18:01:06Z,0,2,1,1,6,0,6,107640.0
5750,web_developer entering the arena,1566,True,True,2023-10-16T18:00:07Z,2023-10-16T18:00:07Z,0,2,1,1,6,0,6,102236.0
5752,robot entering the arena,1559,True,True,2023-10-16T17:58:49Z,2023-10-16T17:58:49Z,0,2,1,1,6,0,6,101339.0
5753,r entering the arena,1555,True,False,,2023-10-16T17:59:01Z,0,2,1,3,18,0,18,0
5754,dev_agent entering the arena,1566,True,True,2023-10-16T17:56:41Z,2023-10-16T17:56:41Z,0,2,1,1,6,0,6,99091.0
5755,dda entering the arena,1559,True,True,2023-10-16T17:56:11Z,2023-10-16T17:56:11Z,0,2,1,1,6,0,6,85983.0
5757,TraceLLMAgent entering the arena,1566,True,True,2023-10-16T17:55:38Z,2023-10-16T17:55:38Z,0,2,1,1,6,0,6,72416.0
5764,teacher entering the arena,1563,True,True,2023-10-16T17:55:00Z,2023-10-16T17:55:01Z,0,2,1,1,6,0,6,37985.0
5765,zze entering the arena,1562,True,True,2023-10-16T17:54:09Z,2023-10-16T17:54:09Z,0,2,1,1,6,0,6,36274.0
5766,Auto entering the arena,1560,True,True,2023-10-16T17:52:57Z,2023-10-16T17:52:58Z,0,2,2,1,6,0,6,31236.0
5767,Raslebot entering the arena,640,True,True,2023-10-16T17:52:31Z,2023-10-16T17:52:31Z,0,2,1,1,6,0,6,20773.0
5768,ExampleAgent entering the arena,1571,True,True,2023-10-16T17:51:54Z,2023-10-16T17:51:54Z,0,2,1,1,6,0,6,20337.0
5769,UmaruAgent entering the arena,1562,True,True,2023-10-16T17:51:21Z,2023-10-16T17:51:21Z,0,2,1,1,6,0,6,14400.0
5763,AutoGPT-go entering the arena,1568,True,False,,2023-10-16T07:22:50Z,0,1,2,1,6,0,6,0
5758,searchagent entering the arena,1569,True,True,2023-10-16T02:53:57Z,2023-10-16T02:53:57Z,0,2,1,1,6,0,6,10322.0
5353,Update Dockerfile install layer,791,True,False,,2023-10-15T11:35:37Z,1,3,3,1,2,6,8,0
5748,intern entering the arena,1566,True,False,,2023-10-15T09:25:08Z,0,2,1,1,6,0,6,0
5745,Maurice entering the arena,1559,True,False,,2023-10-14T20:24:29Z,0,1,1,1,6,0,6,0
5740,YOUR_AGENT_NAME1 entering the arena,640,True,False,,2023-10-14T10:13:38Z,0,1,1,1,6,0,6,0
5738,MYTEST entering the arena,1561,True,False,,2023-10-14T06:54:42Z,0,1,1,1,6,0,6,0
100,Fix .gitignore to include the correct path to auto_gpt_workspace,0,True,True,2023-04-06T06:42:19Z,2023-04-06T06:42:19Z,1,2,1,1,1,1,2,213679.0
5727,PaperPro entering the arena,640,True,False,,2023-10-13T23:20:46Z,0,1,1,1,6,0,6,0
5470,dive2code entering the arena,1565,True,True,2023-10-02T17:46:14Z,2023-10-02T17:46:14Z,0,2,1,1,6,0,6,3922.0
5726,playground_agent entering the arena,640,True,False,,2023-10-13T16:34:17Z,0,1,1,1,6,0,6,0
5716,fritzgpt2 entering the arena,1562,True,False,,2023-10-13T04:06:03Z,0,2,1,2,12,0,12,0
5703,autoGpt_dev entering the arena,1568,True,False,,2023-10-13T00:12:43Z,0,1,2,303,49363,7,49370,0
5706,da-agent entering the arena,1563,True,True,2023-10-12T14:24:57Z,2023-10-12T14:24:57Z,0,2,1,1,6,0,6,2847.0
5707,Jarvis entering the arena,1561,True,True,2023-10-12T14:24:01Z,2023-10-12T14:24:01Z,0,2,1,1,6,0,6,522.0
5702,b113 entering the arena,640,True,False,,2023-10-12T08:36:29Z,0,1,1,1,6,0,6,0
5701,b123 entering the arena,640,True,False,,2023-10-12T08:36:28Z,0,1,1,1,6,0,6,0
5695,GraveyardShift entering the arena,1580,True,False,,2023-10-12T00:20:36Z,0,2,1,1,6,0,6,0
5690,Verkiezingsprogrammas entering the arena,1577,True,True,2023-10-11T16:07:42Z,2023-10-11T16:07:42Z,0,2,1,1,6,0,6,15611.0
5692,smith entering the arena,1562,True,True,2023-10-11T16:07:05Z,2023-10-11T16:07:05Z,0,2,1,1,6,0,6,13314.0
5691,my_agent entering the arena,1565,True,False,,2023-10-11T12:15:41Z,0,1,1,1,6,0,6,0
5595,NA_AGENT entering the arena,1565,True,False,,2023-10-11T11:05:10Z,0,1,2,1,6,0,6,0
5676,Arena submission my bloody killer,640,True,False,,2023-10-11T08:58:10Z,1,2,1,5,30,0,30,0
5682,yolov8_sku_detect_and_tracker_agent entering the arena,1589,True,False,,2023-10-11T08:40:20Z,0,1,1,1,6,0,6,0
5687,yolov8_sku_detector_and_tracker_agent_1011_3 entering the arena,1598,True,False,,2023-10-11T08:40:08Z,0,1,1,1,6,0,6,0
5686,yolov8_sku_detector_and_tracker_agent_1011_2 entering the arena,1598,True,False,,2023-10-11T08:39:57Z,0,1,1,1,6,0,6,0
5685,yolov8_sku_detector_and_tracker_agent_1011 entering the arena,1596,True,False,,2023-10-11T08:39:46Z,0,1,2,1,6,0,6,0
