Number,Title,Body,Closed,Merged,MergedAt,ClosedAt,ReviewComments,Participants,Comments,Files,Additions,Deletions,Modifications,TimeToMergeOrClose
4628,Streamline / clarify shell command control configuration,1746,True,True,2023-06-09T18:48:21Z,2023-06-09T18:48:21Z,1,3,2,4,70,39,109,77044.0
4649,Use prompt_toolkit to enable keyboard navigation in CLI,1337,True,True,2023-06-11T21:19:42Z,2023-06-11T21:19:42Z,1,4,3,5,11,6,17,57528.0
4561,make run.sh more compatible,827,True,True,2023-06-11T23:44:18Z,2023-06-11T23:44:18Z,2,6,3,1,2,2,4,725834.0
4642,fix-bug-#4612 re pr,784,True,False,,2023-06-11T23:38:31Z,0,1,5,3,22,2,24,0
4659,Remove extra spaces in the summarization prompt,749,True,False,,2023-06-11T23:06:24Z,0,1,3,0,0,0,0,0
3757,Stop ignoring small files in split_file,1467,True,False,,2023-06-11T22:22:50Z,1,5,8,1,1,1,2,0
4657,Change memory challenge c expectations,935,True,True,2023-06-11T21:34:03Z,2023-06-11T21:34:03Z,3,4,2,2,13,13,26,4628.0
4653,Fix benchmark logs,854,True,True,2023-06-11T14:34:58Z,2023-06-11T14:34:58Z,1,2,2,3,5,5,10,5466.0
4648,Retry regression tests,1068,True,True,2023-06-11T14:21:27Z,2023-06-11T14:21:27Z,1,2,4,12,63,83,146,58724.0
4636,Fix bug #4612,588,True,False,,2023-06-11T05:32:05Z,0,2,3,4,15,1,16,0
4606,Beat Challenges if cassettes changed and update challenge scores,968,True,False,,2023-06-11T00:46:28Z,8,2,5,2,137,20,157,0
4645,Pass agent to commands instead of config,861,True,True,2023-06-10T22:48:51Z,2023-06-10T22:48:51Z,3,3,17,35,390,386,776,15200.0
4647,Create benchmarks that will run Regression Tests and unbeaten challenges,958,True,True,2023-06-10T22:11:25Z,2023-06-10T22:11:25Z,2,3,2,4,80,4,84,7624.0
4640,Upload logs as artifact,676,True,True,2023-06-10T22:07:03Z,2023-06-10T22:07:03Z,2,3,2,1,7,0,7,69921.0
4638,"Add config as attribute to Agent, rename old config to ai_config",902,True,True,2023-06-10T21:47:26Z,2023-06-10T21:47:26Z,4,3,2,7,81,59,140,74345.0
4562,"Add ability to only install plugin deps, install them on image build",1358,True,False,,2023-06-10T21:37:12Z,1,3,12,2,14,0,14,0
4478,new UI for ai_settings yaml to support multiple configurations,1855,True,False,,2023-06-10T19:08:24Z,4,3,52,6,1938,177,2115,0
4639,Decrement memory challenge c,612,True,True,2023-06-10T03:46:06Z,2023-06-10T03:46:06Z,2,3,2,1,1,1,2,7481.0
3576,feat: add .python-version and use it in GHA,962,True,False,,2023-06-10T02:47:31Z,0,3,5,4,6,13,19,0
4623,Fix prompt issue causing 'No Command' issues and challenge b to fail,1265,True,True,2023-06-10T00:25:04Z,2023-06-10T00:25:04Z,1,3,5,2,2,4,6,162338.0
4581,Add command for directly executing python code,2657,True,True,2023-06-09T17:40:33Z,2023-06-09T17:40:33Z,24,5,22,2,77,2,79,406415.0
4486,Quicker logs in pytest,816,True,True,2023-06-09T22:18:57Z,2023-06-09T22:18:57Z,2,3,7,4,16,31,47,857173.0
4622,Fix issues with information retrieval challenge a,884,True,True,2023-06-09T18:02:52Z,2023-06-09T18:02:52Z,1,3,3,1,3,3,6,142072.0
4637,Decrement information retrieval challenge a so that it doesn't break the CI,672,True,True,2023-06-09T17:02:04Z,2023-06-09T17:02:04Z,1,3,3,2,2,2,4,982.0
4635,test challenges,588,True,False,,2023-06-09T16:48:23Z,0,1,1,2,2,2,4,0
4626,Implement quicker logs using plain_output,594,True,False,,2023-06-09T16:47:45Z,1,2,2,2,10,6,16,0
4631,temporarily remove analyze_code,1709,True,False,,2023-06-09T15:52:59Z,0,3,5,3,3,41,44,0
4632,"Fix ""debug code"" challenge",737,True,True,2023-06-09T15:40:06Z,2023-06-09T15:40:06Z,2,4,6,14,143,104,247,10007.0
4481,"Make challenge ""write file"" harder + add level 2",781,True,True,2023-06-09T14:50:57Z,2023-06-09T14:50:57Z,2,4,10,3,67,50,117,858904.0
4616,Inform users that challenges can be flaky,699,True,True,2023-06-09T14:43:56Z,2023-06-09T14:43:56Z,3,4,3,1,5,2,7,162352.0
882,Update .gitignore,580,True,True,2023-06-07T05:12:13Z,2023-06-07T05:12:13Z,10,9,13,1,1,6,7,4853910.0
2066,Driver customization options,1027,True,False,,2023-06-09T01:53:15Z,3,8,23,3,15,6,21,0
4587,"CI test (draft, ignore)",23,True,False,,2023-06-08T14:43:11Z,0,2,12,1,1,1,2,0
4577,Fix 500 errors in challenges,611,True,False,,2023-06-08T14:43:07Z,0,2,7,1,1,1,2,0
4498,Feat  set token limits based on model,954,True,True,2023-06-07T08:16:54Z,2023-06-07T08:16:54Z,2,6,12,4,5,49,54,554518.0
4620,Set proxy headers as secrets,647,True,True,2023-06-08T02:39:08Z,2023-06-08T02:39:08Z,1,2,2,1,2,2,4,9819.0
4580,"CI test (Draft, ignore)",23,True,True,2023-06-07T18:10:29Z,2023-06-07T18:10:29Z,0,2,99,0,0,0,0,240683.0
3713,add mode for python execution,1098,True,False,,2023-06-07T09:58:50Z,0,5,15,4,104,50,154,0
3588,Large file fix,437,True,False,,2023-06-07T09:39:55Z,1,4,6,1,32,0,32,0
4445,Update support for Azure Openai,986,True,False,,2023-06-07T07:05:06Z,1,3,8,0,0,0,0,0
4610,Update .gitignore,703,True,True,2023-06-07T06:46:10Z,2023-06-07T06:46:10Z,1,2,2,1,2,2,4,3519.0
1569,feat: log new-line so user can differentiate sections better in console,784,True,True,2023-06-07T05:32:44Z,2023-06-07T05:32:44Z,6,6,10,1,4,0,4,4551022.0
2280,updated readme with python venv instructions,377,True,False,,2023-06-07T00:43:33Z,1,5,10,1,21,2,23,0
2821,Dockerfile: reduce layer bloat,1141,True,True,2023-06-07T01:14:47Z,2023-06-07T01:14:47Z,6,9,9,1,5,3,8,4010394.0
3737,Added the Ability to change Memory Backend Types.,616,True,False,,2023-06-07T00:50:18Z,0,4,5,7,203,3,206,0
2250,"Use redis image ""redis-stack"" + rename redis host in docker-compose.yml",1793,True,False,,2023-06-07T00:42:54Z,11,7,6,1,7,1,8,0
605,Docker for Redis Stack,1724,True,False,,2023-06-07T00:42:23Z,2,6,8,4,48,6,54,0
2196,Fixed issues with running redis command due to the use of the redis-s…,1051,True,False,,2023-06-07T00:41:32Z,3,5,4,2,6,2,8,0
2202,make the redis stack server name more intention revealing,484,True,False,,2023-06-07T00:40:49Z,1,5,4,1,1,1,2,0
3434,this is a way to help people who use docker to persist output to host,905,True,False,,2023-06-07T00:29:44Z,0,2,4,1,1,0,1,0
4602,Increase thresholds for PR autolabeler,259,True,True,2023-06-06T23:37:43Z,2023-06-06T23:37:43Z,1,2,1,1,3,4,7,261.0
4592,Fix duckduckgo rate limiting,949,True,True,2023-06-06T23:20:53Z,2023-06-06T23:20:53Z,2,4,7,1,15,7,22,73405.0
4601,Update cassette submodule,1219,True,True,2023-06-06T21:46:41Z,2023-06-06T21:46:41Z,1,3,2,2,3,2,5,1973.0
4563,Fix inverted logic for deny_command,837,True,True,2023-06-06T20:56:17Z,2023-06-06T20:56:17Z,4,3,3,2,9,1,10,260668.0
1725,Organize unit & integration tests,1705,True,False,,2023-06-06T20:36:59Z,1,7,27,21,448,528,976,0
4539,Release v0.4.0,892,True,True,2023-06-05T14:05:49Z,2023-06-05T14:05:49Z,5,38,28,196,5626,12540,18166,319087.0
4251,hotfix for JsonDecodes error,586,True,False,,2023-06-06T18:46:42Z,0,5,7,1,12,8,20,0
4596,Rearrange tests & fix CI,1413,True,True,2023-06-06T17:48:50Z,2023-06-06T17:48:50Z,3,3,14,59,150,377,527,8610.0
4591,"Fix ""update cassettes"" step",814,True,True,2023-06-06T14:27:08Z,2023-06-06T14:27:08Z,10,4,3,8,55,74,129,52590.0
4585,Sync release v0.4.0 back into `master`,9,True,True,2023-06-05T14:31:22Z,2023-06-05T14:31:22Z,1,3,4,7,126,122,248,1681.0
4547,"CI Test (draft, ignore)",23,True,False,,2023-06-04T23:17:45Z,0,2,48,0,0,0,0,0
4570,"Ci test (draft, ignore)",23,True,False,,2023-06-04T23:13:21Z,0,3,3,9,111,131,242,0
4566,"CI test (draft, ignore)",15,True,False,,2023-06-04T02:59:20Z,0,2,11,0,0,0,0,0
4576,Add highlights for v0.4.0 release to BULLETIN.md,136,True,True,2023-06-04T17:31:58Z,2023-06-04T17:31:58Z,2,3,1,1,16,3,19,3879.0
4565,Add `replace_in_file` command to change occurrences of text in a file,597,True,True,2023-06-04T17:37:36Z,2023-06-04T17:37:36Z,7,4,4,2,110,0,110,65240.0
4573,Skip flaky challenges,789,True,True,2023-06-04T16:20:14Z,2023-06-04T16:20:14Z,2,3,2,1,3,3,6,6070.0
4497,Update setup.md,1218,True,False,,2023-06-04T15:26:27Z,0,4,6,1,101,191,292,0
4554,Fix `test_web_selenium`,643,True,True,2023-06-04T14:38:32Z,2023-06-04T14:38:32Z,0,2,1,1,4,1,5,148515.0
3694,Patch `master` with fixes from `release-v0.3`,19,True,True,2023-05-02T15:01:05Z,2023-05-02T15:01:05Z,1,4,3,7,119,98,217,355.0
4568,"CI test (draft, ignore)",23,True,True,2023-06-04T03:32:13Z,2023-06-04T03:32:13Z,0,2,4,1,1,1,2,1788.0
4555,"CI test (draft, ignore)",23,True,True,2023-06-04T01:16:18Z,2023-06-04T01:16:18Z,0,1,26,0,0,0,0,97990.0
3643,update_file method to change occurences of text in a file,686,True,False,,2023-06-03T23:10:35Z,4,8,37,4,93,1,94,0
4488,Cache Python Packages in the CI pipeline,639,True,True,2023-06-03T14:48:32Z,2023-06-03T14:48:32Z,5,5,11,2,19,1,20,308590.0
4553,remove news about config,613,True,True,2023-06-02T21:09:16Z,2023-06-02T21:09:16Z,0,2,1,1,0,3,3,84.0
4552,Fix CI for internal PRs with CI changes,792,True,True,2023-06-02T20:49:05Z,2023-06-02T20:49:05Z,6,5,9,1,145,14,159,7189.0
4207,Cassette diff 4172,377,True,False,,2023-06-02T20:12:58Z,0,2,3,319,23199,33,23232,0
3685,Feature/prompt coverage in ci pipeline,377,True,False,,2023-05-02T18:15:32Z,7,2,21,10,1862,1133,2995,0
3703,run openai calls in ci pipeline,417,True,False,,2023-05-14T13:30:34Z,0,2,3,1,11,0,11,0
4017,Feature/implement benchmarks.yml (from base repo),457,True,False,,2023-05-14T13:30:04Z,0,1,2,7,160,11,171,0
4528,Update Score In Pull Request Number 4526,115,True,False,,2023-06-01T19:57:58Z,0,2,1,1,6,0,6,0
4530,Update Score In Pull Request Number 4528,115,True,False,,2023-06-01T19:58:00Z,0,2,1,1,7,0,7,0
4529,Update Score In Pull Request Number 4527,115,True,False,,2023-06-01T19:57:59Z,0,2,1,1,14,0,14,0
4531,Update Score In Pull Request Number 4529,115,True,False,,2023-06-01T19:58:00Z,0,2,1,1,15,0,15,0
4532,Update Score In Pull Request Number 4530,115,True,False,,2023-06-01T19:58:01Z,0,2,1,1,8,0,8,0
4533,Update Score In Pull Request Number 4531,115,True,False,,2023-06-01T19:58:02Z,0,2,1,1,16,0,16,0
4534,Update Score In Pull Request Number 4532,115,True,False,,2023-06-01T19:58:02Z,0,2,1,1,9,0,9,0
4535,Update Score In Pull Request Number 4533,115,True,False,,2023-06-01T19:58:03Z,0,2,1,1,17,0,17,0
4536,Update Score In Pull Request Number 4534,115,True,False,,2023-06-01T19:58:04Z,0,2,1,1,1,0,1,0
4537,Update Score In Pull Request Number 4535,115,True,False,,2023-06-01T19:58:05Z,0,2,1,1,1,0,1,0
4510,Update Score In Pull Request Number 4509,115,True,False,,2023-06-01T19:15:05Z,0,2,1,1,1,0,1,0
4512,Update Score In Pull Request Number 4511,115,True,False,,2023-06-01T19:57:48Z,0,2,1,1,3,0,3,0
4511,Update Score In Pull Request Number 4510,115,True,False,,2023-06-01T19:58:15Z,0,2,1,1,2,0,2,0
4513,Update Score In Pull Request Number 4512,115,True,False,,2023-06-01T19:57:49Z,0,2,1,1,4,0,4,0
4515,Update Score In Pull Request Number 4514,115,True,False,,2023-06-01T19:57:51Z,0,2,1,1,6,0,6,0
4514,Update Score In Pull Request Number 4513,115,True,False,,2023-06-01T19:57:50Z,0,2,1,1,5,0,5,0
4516,Update Score In Pull Request Number 4515,115,True,False,,2023-06-01T19:57:51Z,0,2,1,1,7,0,7,0
4517,Update Score In Pull Request Number 4509,115,True,False,,2023-06-01T19:19:21Z,0,2,1,1,1,0,1,0
4523,Update Score In Pull Request Number 4521,115,True,False,,2023-06-01T19:57:55Z,0,2,1,1,11,0,11,0
4518,Update Score In Pull Request Number 4516,115,True,False,,2023-06-01T19:57:52Z,0,2,1,1,8,0,8,0
4522,Update Score In Pull Request Number 4519,115,True,False,,2023-06-01T19:57:55Z,0,2,1,1,3,0,3,0
4521,Update Score In Pull Request Number 4520,115,True,False,,2023-06-01T19:57:54Z,0,2,1,1,10,0,10,0
4520,Update Score In Pull Request Number 4518,115,True,False,,2023-06-01T19:57:53Z,0,2,1,1,9,0,9,0
4519,Update Score In Pull Request Number 4517,115,True,False,,2023-06-01T19:57:53Z,0,2,1,1,2,0,2,0
4524,Update Score In Pull Request Number 4522,115,True,False,,2023-06-01T19:57:56Z,0,2,1,1,4,0,4,0
4527,Update Score In Pull Request Number 4525,115,True,False,,2023-06-01T19:57:58Z,0,2,1,1,13,0,13,0
4526,Update Score In Pull Request Number 4524,115,True,False,,2023-06-01T19:57:57Z,0,2,1,1,5,0,5,0
4525,Update Score In Pull Request Number 4523,115,True,False,,2023-06-01T19:57:56Z,0,2,1,1,12,0,12,0
4509,"CI test (draft, ignore)",23,True,True,2023-06-02T14:17:24Z,2023-06-02T14:17:24Z,0,2,37,1,2,0,2,68796.0
4299,Automated self feedback,3234,True,False,,2023-06-01T19:32:47Z,0,5,44,18,648,223,871,0
4544,HalukNRS,588,True,False,,2023-06-02T05:51:36Z,0,2,3,2,17,14,31,0
4541,Initial commit,588,True,False,,2023-06-02T00:34:42Z,0,2,3,0,0,0,0,0
4543,Initial commit,588,True,False,,2023-06-02T00:34:35Z,0,2,3,0,0,0,0,0
4508,"CI test (draft, ignore)",23,True,True,2023-06-01T19:07:54Z,2023-06-01T19:07:54Z,0,2,15,0,0,0,0,3943.0
4507,"CI test (draft, ignore)",23,True,False,,2023-06-01T18:01:01Z,0,2,3,15,94,61,155,0
4499,Ci test 60 (draft ignore),22,True,False,,2023-06-01T17:08:15Z,0,2,30,1,2,2,4,0
4128,feat: set max token limits for better user experience,954,True,False,,2023-05-31T22:03:24Z,20,7,35,0,0,0,0,0
4500,Ci test 60,588,True,False,,2023-06-01T03:28:21Z,0,1,1,14,127,19,146,0
4462,Improve the steps for running docker compose in the setup documentation,1192,True,True,2023-05-29T16:24:38Z,2023-05-29T16:24:38Z,2,3,2,1,10,5,15,5180.0
4495,"CI test (draft, ignore)",16,True,True,2023-05-31T22:21:08Z,2023-05-31T22:21:08Z,0,2,5,12,21,13,34,17698.0
4259,setup challenges score,1516,True,False,,2023-05-31T18:47:27Z,0,3,12,17,648,84,732,0
3865,Debug code challenge A,373,True,False,,2023-05-31T18:22:48Z,0,2,8,3,310,0,310,0
4490,Ci test (draft),588,True,True,2023-05-31T17:17:34Z,2023-05-31T17:17:34Z,0,1,5,1,4,1,5,50615.0
3278,Fix MilvusMemory connecting to Zilliz,474,True,True,2023-04-27T01:57:29Z,2023-04-27T01:57:29Z,2,4,4,1,7,7,14,85825.0
4457,Create Debug Code Challenge,594,True,False,,2023-05-30T23:07:29Z,0,2,9,7,152,2,154,0
1354,Full prompt test cases,1009,True,False,,2023-05-31T13:44:15Z,2,9,14,14,355,0,355,0
4483,ci test,588,True,True,2023-05-31T03:08:29Z,2023-05-31T03:08:29Z,0,1,11,2,6,1,7,30881.0
289,Adding support for openai_organization env variable,14,True,True,2023-05-31T02:02:17Z,2023-05-31T02:02:17Z,5,9,11,2,5,0,5,4747198.0
4485,Ignore cassettes and current score for all push events,718,True,True,2023-05-31T00:16:49Z,2023-05-31T00:16:49Z,1,2,2,2,6,0,6,2317.0
4286,"Create ""Debug Code Challenge""",1025,True,True,2023-05-30T23:28:32Z,2023-05-30T23:28:32Z,2,3,18,7,152,2,154,1066589.0
3144,"Fix #942: Respect --gpt4only, --gpt3only cli args",1531,True,True,2023-05-29T17:10:51Z,2023-05-29T17:10:51Z,2,8,9,4,105,24,129,3027051.0
4468,"Increase difficulty of the ""information retrieval"" challenge and add a new level",945,True,True,2023-05-30T22:56:59Z,2023-05-30T22:56:59Z,2,3,5,6,83,55,138,98390.0
2577,add --ignore option to data_ingestion.py to ignore directories like .git,684,True,False,,2023-05-30T21:26:39Z,3,7,8,3,16,4,20,0
4482,Ignore push if current score changed,769,True,True,2023-05-30T19:23:49Z,2023-05-30T19:23:49Z,1,2,2,1,1,0,1,3387.0
4456,Information retrieval challenge,594,True,True,2023-05-30T19:10:49Z,2023-05-30T19:10:50Z,3,6,13,5,112,1,113,152024.0
3711,"Feature/add .env fixed ai_name, ai_role and or extra goals",1534,True,False,,2023-05-30T16:17:42Z,0,5,9,2,75,16,91,0
4472,new ui for ai_settings to support multiple configurations,1310,True,False,,2023-05-30T16:15:26Z,0,1,6,6,970,161,1131,0
1687,add autodoc index and config,937,True,False,,2023-05-30T16:05:29Z,0,4,4,102,2060,0,2060,0
1744,Improve browse_website by using a hidden browser instance,1082,True,False,,2023-05-30T14:43:41Z,1,7,11,1,62,22,84,0
4469,Fix #4461: Don't record error requests in challenges,1067,True,True,2023-05-30T14:31:45Z,2023-05-30T14:31:45Z,1,2,5,2,35,11,46,62413.0
897,Mkdocs from auto doc,1282,True,False,,2023-05-30T14:19:38Z,8,6,10,56,3102,0,3102,0
3222,Fix the maximum context length issue by chunking,1048,True,True,2023-05-01T18:13:24Z,2023-05-01T18:13:24Z,10,11,38,9,1801,43,1844,528832.0
4460,Master doesn't beat memory challenge b level 1 in a consistent manner,784,True,True,2023-05-29T15:25:46Z,2023-05-29T15:25:46Z,1,4,4,1,2,2,4,7836.0
4474,add vcr to dalle,611,True,True,2023-05-30T13:00:37Z,2023-05-30T13:00:37Z,1,3,4,1,2,4,6,39278.0
4475,Pedantic grammar update to index.md,588,True,False,,2023-05-30T11:10:13Z,0,2,3,1,1,1,2,0
1621,Support proxy env variable,515,True,False,,2023-05-30T06:03:18Z,2,5,20,0,0,0,0,0
4464,Update current score when PR merged,918,True,True,2023-05-30T02:30:41Z,2023-05-30T02:30:42Z,1,2,4,4,22,6,28,30446.0
4473,Replace 'prompt change' with 'behavior change',643,True,True,2023-05-30T02:01:47Z,2023-05-30T02:01:47Z,1,2,2,1,4,4,8,2538.0
4470,Update Wiki to reflect changes with `docker-compose`,976,True,False,,2023-05-29T21:24:09Z,0,3,2,6,124,38,162,0
4294,feat: move cassettes to git submodule,1488,True,False,,2023-05-29T13:00:57Z,11,5,45,19,36,11642,11678,0
4447,"""Beat Challenges"" Mode",1446,True,True,2023-05-29T07:47:07Z,2023-05-29T07:47:07Z,1,3,12,17,400,82,482,116790.0
4261,Information Retrieval - Challenge b,1075,True,False,,2023-05-29T02:02:03Z,4,3,9,4,112,0,112,0
4452,record challenge performance,588,True,False,,2023-05-28T13:02:57Z,0,1,2,1,3,0,3,0
4449,remove unused imports automatically,626,True,True,2023-05-28T12:50:50Z,2023-05-28T12:50:51Z,4,2,2,33,28,70,98,41240.0
4448,Fix Information Retrieval Challenge,768,True,True,2023-05-28T01:26:30Z,2023-05-28T01:26:30Z,1,3,3,6,8,29,37,5560.0
1,Complete prompt redesign,233,True,True,2023-03-16T23:08:43Z,2023-03-16T23:08:43Z,0,4,3,1,57,49,106,922.0
4422,Stable,377,True,False,,2023-05-26T05:36:07Z,0,5,1,0,0,0,0,0
4441,Added three more tests to check for edge cases in URL validation,459,True,True,2023-05-27T15:58:39Z,2023-05-27T15:58:39Z,1,3,2,2,19,0,19,47599.0
4440,Fix typo and links in documentation,104,True,True,2023-05-27T09:52:39Z,2023-05-27T09:52:39Z,1,2,2,2,4,4,8,37622.0
4438,Update agent.py with useless comment,459,True,False,,2023-05-26T22:41:07Z,0,1,1,1,1,1,2,0
4329,Allow spinning to be disabled,530,True,True,2023-05-26T21:01:34Z,2023-05-26T21:01:34Z,8,3,5,6,30,11,41,463020.0
4434,prompt change test,459,True,False,,2023-05-26T20:23:05Z,0,2,3,1,1,1,2,0
4420,Create cassette submodule,581,True,True,2023-05-26T19:33:50Z,2023-05-26T19:33:50Z,7,3,30,18,171,14404,14575,64697.0
4432,remove cassettes auto commit,655,True,True,2023-05-26T18:02:40Z,2023-05-26T18:02:40Z,1,2,2,1,0,46,46,691.0
4431,Ci test 44,459,True,True,2023-05-26T17:25:52Z,2023-05-26T17:25:52Z,0,2,8,1,1,1,2,722.0
4429,Update setup.md,459,True,False,,2023-05-26T16:24:07Z,0,3,4,1,1,1,2,0
4328,Pass Configs to Commands and remove CFG = Config() in the commands/ folder,1973,True,True,2023-05-26T15:39:25Z,2023-05-26T15:39:25Z,12,7,51,46,1852,397,2249,457667.0
3563,Large embedding fix,392,True,False,,2023-05-26T15:19:05Z,0,5,12,4,200,228,428,0
2039,Truncate text before create_embedding_with_ada(),2676,True,False,,2023-05-26T13:04:55Z,0,6,23,1,9,3,12,0
4426,Update docker-compose.yml,459,True,False,,2023-05-26T14:39:13Z,0,2,2,1,18,10,28,0
4428,ci test,459,True,True,2023-05-26T14:26:32Z,2023-05-26T14:26:32Z,0,2,3,1,1,1,2,577.0
4427,ci test,459,True,True,2023-05-26T14:13:54Z,2023-05-26T14:13:54Z,0,1,1,0,0,0,0,161.0
2088,Fix split_text chunking bug,1172,True,False,,2023-05-26T13:14:06Z,11,9,32,2,122,20,142,0
4402,Switch from pypi to github for auto-gpt-plugin-template,584,True,True,2023-05-26T12:48:37Z,2023-05-26T12:48:37Z,1,2,5,3,58,1,59,79245.0
1461,"Separate memory index for Pinecone, Redis and local cache memory backends",850,True,False,,2023-05-26T11:55:23Z,6,5,13,6,21,16,37,0
1876,Add AnalyticDB as a long-term memory backend.,2620,True,False,,2023-05-26T03:35:11Z,0,5,31,7,429,0,429,0
1515,Add Qdrant as a long memory backend.,2018,True,False,,2023-05-26T03:32:46Z,5,5,15,7,259,0,259,0
2286,"'browse_website' command will stuck in create WebDriver Chrome instance, when exporting the 'https_proxy' env var in terminal.",1147,True,False,,2023-05-26T00:34:51Z,3,5,9,1,20,1,21,0
4419,ci test,459,True,True,2023-05-26T00:25:18Z,2023-05-26T00:25:18Z,0,2,4,1,1,1,2,1842.0
4415,ci test,459,True,True,2023-05-25T23:40:01Z,2023-05-25T23:40:01Z,0,2,3,1,1,1,2,7426.0
4416,Add 30 min timeout for tests,491,True,True,2023-05-25T23:15:27Z,2023-05-25T23:15:27Z,1,2,2,2,2,0,2,4784.0
3551,Improve website summary quality via browse prompt change,5290,True,False,,2023-05-25T21:49:24Z,0,8,26,3,306,6,312,0
3868,Implement Logging of Self-Feedback in logs/Debug Folder,926,True,True,2023-05-17T11:38:43Z,2023-05-17T11:38:43Z,5,7,14,3,36,3,39,996867.0
4266,Add $ to timestamp in ci.yml and improve diff,773,True,True,2023-05-17T16:52:52Z,2023-05-17T16:52:52Z,2,4,2,1,2,2,4,12516.0
3375,Make prompt parameters configurable,3099,True,True,2023-05-17T17:12:10Z,2023-05-17T17:12:10Z,2,10,42,10,168,39,207,1781865.0
3481,switching from unittest to pytest in test_json_parser ,534,True,True,2023-05-18T05:58:09Z,2023-05-18T05:58:09Z,2,5,5,1,78,80,158,1687972.0
4304,Delete sponsors_readme.yml workflow,136,True,True,2023-05-19T15:07:49Z,2023-05-19T15:07:49Z,1,3,2,1,0,28,28,4825.0
4305,Clean up BULLETIN.md,72,True,True,2023-05-19T18:51:37Z,2023-05-19T18:51:37Z,4,5,3,1,28,41,69,13382.0
4307,Added unittest cases for commands/audio_text.py,587,True,True,2023-05-19T19:18:33Z,2023-05-19T19:18:33Z,1,3,5,2,115,0,115,4976.0
4333,Update README.md,53,True,True,2023-05-21T18:26:45Z,2023-05-21T18:26:45Z,1,3,2,1,1,1,2,7804.0
4293,Update 1.bug.yml to improve consistency of data,632,True,True,2023-05-21T23:15:10Z,2023-05-21T23:15:10Z,3,4,3,1,86,55,141,259929.0
1486,Pass command line args as list,932,True,True,2023-05-22T19:53:31Z,2023-05-22T19:53:31Z,3,7,17,2,3,4,7,3245503.0
4363,CI: set base repo before `gh pr checkout`,507,True,True,2023-05-23T12:23:03Z,2023-05-23T12:23:03Z,1,3,2,1,1,0,1,499.0
4368,Fix the version of duckduckgo-search to avoid empty result issue,680,True,True,2023-05-23T15:00:25Z,2023-05-23T15:00:25Z,1,3,2,1,1,1,2,1108.0
4382,empty commit to see cassette status,459,True,True,2023-05-24T16:13:23Z,2023-05-24T16:13:23Z,1,3,4,1,335,0,335,3353.0
4405,Fix duckduckgo-search to 3.0.2 stable version,682,True,True,2023-05-25T16:10:49Z,2023-05-25T16:10:49Z,1,3,2,1,1,1,2,1624.0
4411,Remove obsolete full_message_history kwarg from tests,518,True,True,2023-05-25T19:00:53Z,2023-05-25T19:00:53Z,2,4,2,1,0,2,2,349.0
4257,CI Pipeline: create cassettes in fork,696,True,True,2023-05-17T02:49:12Z,2023-05-17T02:49:12Z,1,3,7,2,33,54,87,12958.0
4234,fix ci cassettes,463,True,True,2023-05-16T03:43:21Z,2023-05-16T03:43:21Z,1,2,3,2,6,4,10,6862.0
4222,Refactor challenges to use cycle count instead of time,790,True,True,2023-05-16T02:44:36Z,2023-05-16T02:44:36Z,5,4,16,23,1088,141,1229,42744.0
3606,"Fixed error in safe_google_results, added tests",439,True,True,2023-05-15T19:54:41Z,2023-05-15T19:54:41Z,1,4,3,2,132,1,133,1267814.0
4226,Fix commands with same name overwriting,572,True,True,2023-05-15T18:41:12Z,2023-05-15T18:41:12Z,6,5,3,1,11,0,11,1579.0
4203,Sync `stable` into `master` after v0.3.1 release,377,True,True,2023-05-15T12:06:32Z,2023-05-15T12:06:32Z,2,4,3,0,0,0,0,60916.0
4412,ci test,459,True,True,2023-05-25T19:39:46Z,2023-05-25T19:39:46Z,0,1,1,0,0,0,0,214.0
3748,Milvus Lite Changes,612,True,False,,2023-05-25T18:52:59Z,1,5,4,3,18,6,24,0
4410,6591/improvement/auto-gpt/add-api,459,True,False,,2023-05-25T17:37:30Z,0,1,1,3,51,3,54,0
4409,ci test,459,True,True,2023-05-25T16:51:43Z,2023-05-25T16:51:43Z,0,1,1,0,0,0,0,185.0
4403,ci test,459,True,True,2023-05-25T15:10:08Z,2023-05-25T15:10:08Z,0,2,2,0,0,0,0,288.0
4398,ci test,459,True,True,2023-05-25T14:59:58Z,2023-05-25T14:59:59Z,0,2,18,0,0,0,0,45094.0
3712,Fix list files function to accept more arguments,2299,True,False,,2023-05-25T11:10:09Z,0,5,34,6,2619,23,2642,0
4381,Remove Twitter Command,541,True,True,2023-05-25T03:40:31Z,2023-05-25T03:40:31Z,1,2,7,6,951,44,995,47623.0
4399,ci test,459,True,True,2023-05-25T02:38:22Z,2023-05-25T02:38:22Z,0,2,2,0,0,0,0,97.0
4397,ci test,459,True,True,2023-05-25T02:25:53Z,2023-05-25T02:25:53Z,0,2,7,0,0,0,0,16284.0
4395,ci test,459,True,True,2023-05-24T21:41:03Z,2023-05-24T21:41:03Z,0,1,2,0,0,0,0,1148.0
3923,add further step to avoid message summary from breaking,705,True,False,,2023-05-24T21:39:12Z,0,2,4,1,11,4,15,0
4390,ci test,459,True,True,2023-05-24T20:47:06Z,2023-05-24T20:47:06Z,0,1,5,0,0,0,0,2968.0
4394,ci test,459,True,True,2023-05-24T20:53:13Z,2023-05-24T20:53:13Z,0,1,2,0,0,0,0,219.0
4389,ci test,459,True,True,2023-05-24T19:46:49Z,2023-05-24T19:46:49Z,0,1,1,0,0,0,0,40.0
4388,ci test,459,True,True,2023-05-24T19:44:40Z,2023-05-24T19:44:40Z,0,1,1,0,0,0,0,41.0
4386,Ci test 24,459,True,True,2023-05-24T19:34:42Z,2023-05-24T19:34:42Z,0,1,2,0,0,0,0,134.0
4391,ci test,459,True,True,2023-05-24T20:06:52Z,2023-05-24T20:06:52Z,0,1,1,0,0,0,0,49.0
4393,ci test,459,True,True,2023-05-24T20:26:42Z,2023-05-24T20:26:42Z,0,1,1,0,0,0,0,37.0
4392,ci test,459,True,True,2023-05-24T20:20:20Z,2023-05-24T20:20:20Z,0,1,4,0,0,0,0,434.0
4387,ci test,459,True,True,2023-05-24T19:40:25Z,2023-05-24T19:40:25Z,0,1,1,0,0,0,0,59.0
4379,ci test,459,True,True,2023-05-24T19:26:32Z,2023-05-24T19:26:32Z,0,2,1,0,0,0,0,20430.0
4383,Migrate google search to use DDGS.text function,1248,True,True,2023-05-24T16:36:24Z,2023-05-24T16:36:24Z,1,4,2,2,6,5,11,3312.0
4385,empty commit (draft ignore),459,True,False,,2023-05-24T16:20:35Z,0,2,2,0,0,0,0,0
4378,Ci test 22,459,True,True,2023-05-24T13:42:36Z,2023-05-24T13:42:37Z,0,2,1,1,1,1,2,30.0
4377,cassette submodule,459,True,True,2023-05-24T13:14:46Z,2023-05-24T13:14:46Z,0,2,1,0,0,0,0,231.0
4371,Ci test 20 draft ignore,474,True,True,2023-05-24T03:35:10Z,2023-05-24T03:35:10Z,0,2,11,0,0,0,0,35378.0
4370,Ci test 1,476,True,True,2023-05-23T17:37:31Z,2023-05-23T17:37:31Z,0,1,3,0,0,0,0,659.0
2481,Prep for #2291 Allow feedback and interrupting during continuous run,1144,True,False,,2023-05-16T04:53:53Z,6,8,63,7,315,120,435,0
3707,Feature/ability to disallow certain shell commands,1522,True,False,,2023-05-23T14:11:41Z,3,7,9,3,63,6,69,0
4122,Update get_hyperlinks description,963,True,True,2023-05-23T13:47:59Z,2023-05-23T13:47:59Z,2,5,13,4,1457,1279,2736,1017431.0
4365,prompt change (draft ignore),488,True,False,,2023-05-23T12:52:54Z,0,2,3,4,1769,1,1770,0
4362,"Test cassettes (draft, ignore)",490,True,False,,2023-05-23T12:37:34Z,0,2,2,1,271,0,271,0
